{
  "schema_version": "2.0.0",
  "status": "pass-with-waivers",
  "commands": [
    {
      "skill_id": "geo",
      "command": [
        ".venv/bin/python",
        "<yao-meta-root>/scripts/yao.py",
        "validate",
        "skills/geo",
        "--require-manifest"
      ],
      "exit_code": 0,
      "status": "pass",
      "structured_status": null,
      "report_path": null,
      "stdout_tail": "_score\": 80,\n          \"declared_maturity_minimum\": 85,\n          \"computed_governance_band\": \"production\",\n          \"computed_maturity_tier\": \"production\",\n          \"score_breakdown\": {\n            \"metadata_integrity\": 20,\n            \"ownership_and_review\": 20,\n            \"boundary_and_eval\": 15,\n            \"operational_assets\": 20,\n            \"maintenance_evidence\": 5\n          }\n        }\n      }\n    },\n    {\n      \"command\": \"resource_boundary_check.py skills/geo\",\n      \"ok\": true,\n      \"returncode\": 0,\n      \"payload\": {\n        \"ok\": true,\n        \"failures\": [],\n        \"warnings\": [],\n        \"stats\": {\n          \"context_budget_tier\": \"production\",\n          \"context_budget_limit\": 1000,\n          \"skill_body_tokens\": 275,\n          \"other_text_tokens\": 1929,\n          \"estimated_initial_load_tokens\": 494,\n          \"estimated_total_text_tokens\": 2204,\n          \"deferred_resource_tokens\": 665,\n          \"deferred_resource_warn_threshold\": 120000,\n          \"deferred_resource_dirs\": [\n            {\n              \"path\": \"references\",\n              \"estimated_tokens\": 383,\n              \"file_count\": 1\n            },\n            {\n              \"path\": \"evals\",\n              \"estimated_tokens\": 182,\n              \"file_count\": 2\n            },\n            {\n              \"path\": \"scripts\",\n              \"estimated_tokens\": 100,\n              \"file_count\": 1\n            }\n          ],\n          \"large_deferred_resource_dirs\": [],\n          \"deferred_resource_governance\": {\n            \"status\": \"not-required\",\n            \"large_dir_count\": 0,\n            \"governed_large_dir_count\": 0,\n            \"directories\": [],\n            \"summary\": \"No large deferred resource directory exceeds the per-dir threshold.\"\n          },\n          \"relevant_file_count\": 11,\n          \"unused_resource_dirs\": [],\n          \"quality_signal_points\": 115,\n          \"quality_density\": 232.8\n        }\n      }\n    }\n  ]\n}\n",
      "stderr_tail": "",
      "report_digest": null
    },
    {
      "skill_id": "geo",
      "command": [
        ".venv/bin/python",
        "<yao-meta-root>/scripts/trigger_eval.py",
        "--description",
        "Route GEO and generative engine optimization requests to an available GEO SEO Hub capability. Use for broad GEO requests, workflow selection, capability checks, or requests spanning discovery, brand/site/page diagnosis, content, strategy, knowledge, publishing, and measurement.",
        "--cases",
        "skills/geo/evals/trigger_cases.json",
        "--semantic-config",
        "skills/geo/evals/semantic_config.json",
        "--threshold",
        "0.2"
      ],
      "exit_code": 0,
      "status": "pass",
      "structured_status": null,
      "report_path": null,
      "stdout_tail": "       ],\n          \"semantic_coverage\": 0.0,\n          \"support_score\": 0,\n          \"lexical_support\": 0.0,\n          \"negative_penalty\": 1.0,\n          \"coverage_boost\": 0.0,\n          \"concept_evidence\": {\n            \"positive\": {},\n            \"negative\": {\n              \"unrelated\": [\n                \"poem\"\n              ]\n            }\n          }\n        }\n      }\n    ],\n    \"near_neighbor\": [\n      {\n        \"prompt\": \"Discover AI search questions\",\n        \"family\": \"default\",\n        \"score\": 0.0,\n        \"predicted_trigger\": false,\n        \"expected_trigger\": false,\n        \"passed\": true,\n        \"score_detail\": {\n          \"mode\": \"semantic-intent\",\n          \"desired_positive_concepts\": [\n            \"owned\"\n          ],\n          \"matched_desired_concepts\": [],\n          \"extra_positive_concepts\": [],\n          \"matched_negative_concepts\": [],\n          \"exclusive_negative_concepts\": [],\n          \"semantic_coverage\": 0.0,\n          \"support_score\": 0,\n          \"lexical_support\": 0.0,\n          \"negative_penalty\": 0,\n          \"coverage_boost\": 0.0,\n          \"concept_evidence\": {\n            \"positive\": {},\n            \"negative\": {}\n          }\n        }\n      },\n      {\n        \"prompt\": \"Audit this page\",\n        \"family\": \"default\",\n        \"score\": 0.027,\n        \"predicted_trigger\": false,\n        \"expected_trigger\": false,\n        \"passed\": true,\n        \"score_detail\": {\n          \"mode\": \"semantic-intent\",\n          \"desired_positive_concepts\": [\n            \"owned\"\n          ],\n          \"matched_desired_concepts\": [],\n          \"extra_positive_concepts\": [],\n          \"matched_negative_concepts\": [],\n          \"exclusive_negative_concepts\": [],\n          \"semantic_coverage\": 0.0,\n          \"support_score\": 0,\n          \"lexical_support\": 0.333,\n          \"negative_penalty\": 0,\n          \"coverage_boost\": 0.0,\n          \"concept_evidence\": {\n            \"positive\": {},\n            \"negative\": {}\n          }\n        }\n      }\n    ]\n  }\n}\n",
      "stderr_tail": "",
      "report_digest": null
    },
    {
      "skill_id": "geo",
      "command": [
        ".venv/bin/python",
        "<yao-meta-root>/scripts/yao.py",
        "skill-ir",
        "skills/geo",
        "--output-json",
        "skills/geo/reports/skill-ir.json"
      ],
      "exit_code": 0,
      "status": "pass",
      "structured_status": "pass",
      "report_path": "skills/geo/reports/skill-ir.json",
      "stdout_tail": "{\n  \"ok\": true,\n  \"schema\": \"<yao-meta-root>/skill-ir/schema.json\",\n  \"skill_dir\": \"skills/geo\",\n  \"artifacts\": {\n    \"json\": \"skills/geo/reports/skill-ir.json\"\n  },\n  \"summary\": {\n    \"name\": \"geo\",\n    \"maturity\": \"library\",\n    \"target_count\": 3,\n    \"trigger_samples\": 2,\n    \"resource_count\": 3\n  },\n  \"failures\": []\n}\n",
      "stderr_tail": "",
      "report_digest": "40471743a0b72fdb26714b026b77413b8546d419830c364adc4945b4fecd4c3f"
    },
    {
      "skill_id": "geo",
      "command": [
        ".venv/bin/python",
        "<yao-meta-root>/scripts/yao.py",
        "skill-ir",
        "skills/geo",
        "--output-json",
        "reports/yao-meta/geo-skill-ir.json"
      ],
      "exit_code": 0,
      "status": "pass",
      "structured_status": "pass",
      "report_path": "reports/yao-meta/geo-skill-ir.json",
      "stdout_tail": "{\n  \"ok\": true,\n  \"schema\": \"<yao-meta-root>/skill-ir/schema.json\",\n  \"skill_dir\": \"skills/geo\",\n  \"artifacts\": {\n    \"json\": \"reports/yao-meta/geo-skill-ir.json\"\n  },\n  \"summary\": {\n    \"name\": \"geo\",\n    \"maturity\": \"library\",\n    \"target_count\": 3,\n    \"trigger_samples\": 2,\n    \"resource_count\": 3\n  },\n  \"failures\": []\n}\n",
      "stderr_tail": "",
      "report_digest": "40471743a0b72fdb26714b026b77413b8546d419830c364adc4945b4fecd4c3f"
    },
    {
      "skill_id": "geo",
      "command": [
        ".venv/bin/python",
        "<yao-meta-root>/scripts/yao.py",
        "output-eval",
        "--cases",
        "skills/geo/evals/output/cases.jsonl",
        "--output-json",
        "reports/yao-meta/geo-output-eval.json",
        "--output-md",
        "reports/yao-meta/geo-output-eval.md",
        "--blind-pack-json",
        "reports/yao-meta/geo-blind-pack.json",
        "--blind-pack-md",
        "reports/yao-meta/geo-blind-pack.md",
        "--blind-answer-key-json",
        "reports/yao-meta/geo-blind-answer-key.json"
      ],
      "exit_code": 0,
      "status": "pass",
      "structured_status": "pass",
      "report_path": "reports/yao-meta/geo-output-eval.json",
      "stdout_tail": "       \"missing\": [\n              \"geo\",\n              \"no specific stage\"\n            ],\n            \"present_forbidden\": []\n          }\n        ],\n        \"failed\": [\n          {\n            \"id\": \"unknown\",\n            \"description\": \"The output must satisfy the declared contract.\",\n            \"weight\": 1.0,\n            \"failure_type\": \"assertion_failed\",\n            \"passed\": false,\n            \"missing\": [\n              \"geo\",\n              \"no specific stage\"\n            ],\n            \"present_forbidden\": []\n          }\n        ]\n      },\n      \"with_skill\": {\n        \"score\": 100.0,\n        \"passed_count\": 1,\n        \"failed_count\": 0,\n        \"checks\": [\n          {\n            \"id\": \"unknown\",\n            \"description\": \"The output must satisfy the declared contract.\",\n            \"weight\": 1.0,\n            \"failure_type\": \"assertion_failed\",\n            \"passed\": true,\n            \"missing\": [],\n            \"present_forbidden\": []\n          }\n        ],\n        \"failed\": []\n      },\n      \"delta\": 100.0,\n      \"winner\": \"with_skill\",\n      \"failure_taxonomy\": []\n    }\n  ],\n  \"failures\": [],\n  \"blind_review\": {\n    \"pack\": \"reports/yao-meta/geo-blind-pack.json\",\n    \"answer_key\": \"reports/yao-meta/geo-blind-answer-key.json\",\n    \"pair_count\": 5\n  },\n  \"artifacts\": {\n    \"json\": \"reports/yao-meta/geo-output-eval.json\",\n    \"markdown\": \"reports/yao-meta/geo-output-eval.md\",\n    \"blind_review_pack_json\": \"reports/yao-meta/geo-blind-pack.json\",\n    \"blind_review_pack_md\": \"reports/yao-meta/geo-blind-pack.md\",\n    \"blind_answer_key_json\": \"reports/yao-meta/geo-blind-answer-key.json\"\n  }\n}\n",
      "stderr_tail": "",